,title,artist,date,description,text,tags,group,Dirigido a,Ubicación,Duración,Precio,event,category,url,image
135,Encuentro con Graciela Baquero,No definido,15 dic 2022,,"En 1997 se publicó uno de los títulos más importantes de la poesía contemporánea española, Crónicas de olvido, de Graciela Baquero, un libro descatalogado al que Asociación Genialogías, en colaboración la editorial Tigres de Papel, ha querido dar nueva vida y situar en el centro del la conversación y la investigación poética. En palabras de Pilar González España, autora del prólogo, en este libro se produce un desdoblamiento de la voz donde ""lo importante es el diálogo interno que se establece entre el uno y su doble: el uno al lado del otro, el uno frente al otro, el uno siendo el otro. ¿Cómo se aman, cómo se odian, cómo se superponen, cómo se poseen? (...) Un binomio perfecto imposible de separar.
Nacen y mueren juntas y, sin embargo, nacen, ambas se dedican, a la vez, a la contemplación de las calles, a jugar y a perseguir, a huir, a hacer de madre e hija, hija y madre respectivamente; son hermanas que aman/odian a la madre, a la que llaman y reclaman porque las dos han sido abandonadas"". Genialogías es una asociación feminista de mujeres poetas con más de 70 integrantes que tiene vocación de ahondar en las causas de la marginalidad del discurso femenino y trabajar para su recuperación y su protagonismo.
Graciela Baquero nació en Pontevedra, España en 1960. Cursó estudios de Filosofía. Fue galardonada con el premio de poesía de la Universidad Politécnica de Madrid y el Premio Internacional Puerta de Oro de relatos, con el que publicaría su libro Pintura sobre agua (1990).",[''],Encuentro con autores 2022,,,1 hora 30 minutos,,No details,['ENCUENTROS'],https://www.lacasaencendida.es/encuentros/encuentro-graciela-baquero,https://www.lacasaencendida.es/storage/6302/responsive-images/14237-609f-graciela_baquero_2022_nt___detail_1600_939.jpg
136,Día de los Derechos Humanos: confesiones forzadas en Irán,No definido,15 dic 2022,"El 10 de diciembre la comunidad internacional celebra el Día de los Derechos Humanos. En ese marco proyectamos la película documental ""Confesiones Forzadas"" del cineasta iraní Maziar Bahari que intervendrá de manera online en un coloquio posterior en el que también participan María Victoria Caro Bernal, poeta, actriz y gestora cultural; Sergi Camarasa, especialista en el Magreb y América Latina y voz del narrador del documental; Hamid Hosseini, portavoz de la Asociación Iraní pro Derechos Humanos y Fariba Ehsan, presidenta de la Asociación Iraní pro DDHH en España.","Confesiones forzadas, de Maziar Bahari. Irán. 2012. 58'
Las confesiones forzadas siempre han sido unos medios crueles contra los y las arrestados para doblegar sus voluntades de lucha por la libertad y la dignidad humana. Este medio se sigue utilizando por las fuerzas de seguridad en las cárceles de Irán en la actualidad. La última víctima ha sido Sepideh Rashno, a quien en septiembre de 2022 obligaron a confesiones forzadas y se difundió por canales estatales.
El documental Confesiones Forzadas, producido y dirigido por Maziar Bahari, trata de dibujar a fondo las caras de los verdugos y las víctimas de esta brutal práctica a raíz de las protestas del año 2009 en Irán que conmovieron al mundo entero. En la cinta también participan el editor de la revista literaria más importante del país durante los años 80, blogueros y activistas, así como familiares de otras víctimas que hablan, por primera vez, de los abusos físicos y mentales a los que fueron sometidos para que declararan falsamente.
Maziar Bahari. Nacido en Teherán en 1967. Es periodista, cineasta y activista por los derechos humanos. Fue encarcelado por el gobierno iraní desde junio de 2009 hasta octubre de 2009. Ha escrito una memoria familiar, Entonces Vinieron Por Mí, un éxito de ventas según New York Times. Bahari es el fundador del sitio de noticias ‘IranWire’.
Maziar Bahari intervendrá después de la proyección del documental de manera online.",[''],Not in a group,,,2 horas 30 minutos,,No details,"['ENCUENTROS', 'CINE']",https://www.lacasaencendida.es/encuentros/dia-derechos-humanos-confesiones-forzadas-iran,https://www.lacasaencendida.es/storage/6297/responsive-images/14208-609f-dia_derechos_humanos_confesiones_forzadas_2_nt___detail_1600_900.jpg
137,'God Man Dog',Chen Singing,14 dic 2022,"En esta película premiada en el Festival de Berlín, el cineasta Chen Singing se pregunta cómo es posible sobrevivir al capitalismo más descarnado sin perder las bases del humanismo.","God Man Dog, de Chen Singing. Taiwán, 2007. 119’
Ching, una modelo de manos, sufre una depresión postparto con la que su marido, el arquitecto Hsuing, es incapaz de lidiar, llevando a su matrimonio al borde del colapso.
Con una ambiciosa estructura narrativa, un cuidado diseño visual y sonoro, y unas brillantes interpretaciones, God Man Dog se erigió como una de las visiones más lúcidas sobre la sociedad taiwanesa de principios del siglo XXI.
Chen Singing nació en 1974. Sus largometrajes narrativos ilustran brillantemente los absurdos de la sociedad moderna utilizando el realismo mágico, describiendo a personajes que evidencian profundas problemáticas estructurales. God Man Dog fue seleccionada y galardonada en el Forum de Berlín, y pasó por más de treinta festivales de cine.",[''],"Cine taiwanés: Tiempos de amor, juventud y libertad",,,2 horas,,No details,['CINE'],https://www.lacasaencendida.es/cine/god-man-dog-chen-singing,https://www.lacasaencendida.es/storage/6283/responsive-images/14168-609f-god_man_nt___detail_1600_902.jpg
138,La enseñanza de la paz. La banalización del mal,No definido,14 dic 2022,La tensión bélica internacional que hoy vivimos parece no dejar resquicio para hablar de la paz.,"Resulta complicado defender la vía del diálogo ante quién ha sido el causante de la destrucción en Ucrania y cuyas actitudes distan mucho de la cultura democrática que se respira en Occidente. En los medios de comunicación se habla de la posibilidad de una tercera guerra mundial o de un enfrentamiento nuclear, sin que nadie pestañee o le tiemble la voz. Hiroshima y Nagasaki quedan ya muy lejos y no parece haber una conciencia real del riesgo que vive el mundo actualmente.
Participan:
Ana Barrero Tíscar, presidenta de la Asociación Española de Investigación para la Paz (AIPAZ).
Alberto Medina, técnico de Ciudadanía de Entreculturas.",[''],Paz y Memoria. Festival Robert Capa estuvo aquí,,,2 horas,,No details,['ENCUENTROS'],https://www.lacasaencendida.es/encuentros/ensenanza-paz-banalizacion-mal,https://www.lacasaencendida.es/storage/6296/responsive-images/14207-609f-ensenanza_paz_banalizacion_mal_nt___detail_1600_900.jpg
139,DEDODEDO,No definido,14 dic - 16 dic 2022,"Jugar, explorar y entender a través del tacto.","Las palabras, la danza y el espacio serán nuestras guías durante este viaje en el que descubrir las posibilidades de la exploración táctil. A través de pequeñas acciones adaptadas para todas, practicaremos y descubriremos formas de relación directa con el mundo y los demás a través de la piel.
La obra tiene una duración total de 60 minutos, 35 minutos de taller y 25 minutos de performance. Durante el taller, las bailarinas propondrán al grupo diferentes actividades. Posteriormente, durante la obra, se invitará a las niñas y niños a sentarse alrededor de la sala para ver el espectáculo y a intervenir en la pieza en momentos puntuales.
Se aconseja que las niñas y niños lleven ropa cómoda para moverse libremente.
DEDODEDO nace de las investigaciones que CondeGalí BL (Jaime Conde-Salazar & Aimar Pérez Galí) ha desarrollado durante los cuatro últimos años en torno al tacto y la piel.
Se requiere que el profesorado acompañante colabore en crear un espacio de concentración y tranquilidad para que las niñas y niños puedan disfrutar en calma de la experiencia.
Dirigido a: 3.º, 4.º, 5.º y 6.º de primaria.
Impartido por: CondeGalí BL (Oihana Altube + Joan Ferré).
Plazas: 30 participantes máximo (2 sillas de ruedas).",[''],Primaria,,,,,No details,"['ESCÉNICAS', 'ESCOLARES']",https://www.lacasaencendida.es/escenicas/dedodedo,https://www.lacasaencendida.es/storage/6220/responsive-images/14009-609f-dedodedo_nt___detail_1600_900.jpg
140,'Dangerous Youth',Hsin Chi,13 dic 2022,"La obra más impactante y rupturista del cine clásico taiwanés, compartiendo rasgos y actitud con las primeras obras de Nagisa Oshima y Jean-Luc Godard. El arrebatador retrato de una sociedad en tránsito.","Dangerous Youth, de Hsin Chi. Taiwán, 1959. 95’
La inocente Chin-mi se enamora de Kuei-yuan, un conflictivo buscavidas que pronto preferirá a otra mujer. Retrato de una juventud desilusionada y obsesionada con el dinero fácil, la película indaga en la oscura realidad de la sociedad taiwanesa en plena expansión económica. Los jóvenes protagonistas están lejos del modelo oficial regido por la obediencia y el esfuerzo. Buscan enriquecerse y, sobre todo, encontrar la libertad, montando en moto con las melenas al viento y entregándose a las pistas de baile. Dangerous Youth se convirtió en un icono de gran influencia para La Nueva Ola Taiwanesa, en especial para Hou Hsiao-hsien.
Hsin Chi nació en Taipei en 1924. Su nutrida filmografía abarca géneros como el wuxia, el melodrama, la comedia o el thriller. Ha pasado a la historia como el verdadero rebelde del cine clásico taiwanés, desafiando los códigos existentes en la época y abriendo el camino a los audaces integrantes de la nueva ola de los años 80.",[''],"Cine taiwanés: Tiempos de amor, juventud y libertad",,,2 horas,,No details,['CINE'],https://www.lacasaencendida.es/cine/dangerous-youth-hsin-chi,https://www.lacasaencendida.es/storage/6282/responsive-images/14167-609f-dangerous_youth_nt___detail_1600_900.jpg
141,'Lugar seguro',Isaac Rosa,13 dic 2022,"La última sesión del año del Ecoclub de Lectura nos trae la novela Lugar Seguro del escritor español Isaac Rosa. Se trata de una novela muy entretenida en la que, con humor, sarcasmo y queriendo huir de las distopías, como ha declarado en alguna entrevista el autor, aborda cómo responder a la crisis ecosocial (individual o colectivamente).","'Lugar seguro' (Seix Barral), novela ganadora del Premio Biblioteca Breve 2022, supone una reflexión sobre el mundo en el que vivimos, plagado de informaciones contrapuestas, alertas globales, precariedad y, sobre todo, incertidumbre. Ante esto, Issac Rosa propone una divertida historia que critica la filosofía new age y la autoayuda, el autoengaño de la ciudadanía para encontrar explicación y consuelo a sus propias circunstancias.
Tras una breve introducción a cargo de Nacho Santos, coordinador del Ecoclub de lectura, se dará paso a una conversación moderada.
Se recomienda leer la novela antes de la sesión.
La obra está publicada en papel y formato electrónico. Las bibliotecas públicas madrileñas, municipales y de la CAM, cuentan con ejemplares.
Organizado por: Ecoclub de lectura en colaboración con el GIECO, Grupo de Investigación en Ecocrítica (Universidad de Alcalá de Henares).
*Como las plazas son limitadas, se ruega a las personas inscritas que, si finalmente no pueden participar, cancelen su inscripción para dar paso a la lista de espera.",[''],Ecoclub de lectura 2022,,,2 horas,,No details,['ENCUENTROS'],https://www.lacasaencendida.es/encuentros/lugar-seguro-isaac-rosa,https://www.lacasaencendida.es/storage/6278/responsive-images/14161-609f-lugar_seguro_isaac_rosa_nt___detail_1600_900.jpg
142,'El hada de las estaciones' y otros cuentos,No definido,10 dic 2022,"Este programa de cortometrajes gira en torno a la importancia del esfuerzo y la constancia para conseguir lo que nos proponemos. Tres pequeñas historias con protagonistas de lo más decididos, valientes y perseverantes.","El hada de las estaciones (Dame saisons), de Célia Tisserant. Francia, 2020. 26’
Pulgarcita está pasando por la adolescencia y no tiene muchas ganas de colaborar con las tareas de casa. Por culpa de su rebeldía, la pequeña Meñica tiene que cargar con todas las responsabilidades cuando su madre se lesiona trabajando. Un día descubrirá el fantástico mundo del Hada de las estaciones.
Botellas al mar (Les bouteilles à la mer), de Célia Tocco. Francia, 2020. 11’
Théo vive en una casa lejos de la ciudad y a veces se siente solo. Con la esperanza de encontrar un compañero de juegos, escribe un mensaje en una botella y la lanza al mar. ¿Conseguirá que alguien le conteste?
El pollito pelirrojo (Le Petit Poussin roux), de Célia Tisserant. Francia, 2019. 12’
Un delicioso aroma a pastel flota por todo el corral. La granjera está preparando unas exquisitas magdalenas, pero todas ellas tienen dueño... Para poder degustarlas, el pollito pelirrojo decide poner a prueba sus dotes culinarias, siguiendo paso a paso la receta de la granjera.
Duración total del programa: 52'",[''],En Familia. Otoño 2022,,,1 hora,,No details,['CINE'],https://www.lacasaencendida.es/cine/hada-estaciones-otros-cuentos,https://www.lacasaencendida.es/storage/6217/responsive-images/14000-609f-el_hada_de_las_estaciones_en_familia_2022_nt___detail_1600_900.jpg
143,"Pía-pía, arpía",No definido,3 dic 2022,Un vibrante y armónico arpa llenará de música un espacio en el que los bebés pueden moverse libremente.,"Un bellísimo repertorio de música de grandes compositores, especialmente escogido para la franja de edad hasta los 18 meses, es capaz de atraer su atención, despertar su interés, su emoción y su capacidad de escucha. Un primer contacto con la música en directo, en un ambiente distendido, donde los bebés pueden moverse por el espacio sin miedo.
Música de Galuppi, Haendel, Bach, Mozart, Brahms, Debussy, Ligeti o Arvo Pärt va bajando el pulso de pequeños y mayores hasta finalizar la experiencia sonora en un estado de relajación.
Beatriz Millán es una arpista madrileña con una dilatada y variada experiencia profesional que va desde conciertos de solista, con orquesta, profesora de arpa y creadora de espectáculos interdisciplinares. Ha ganado primeros premios en concursos internacionales de arpa, una beca Fulbright y ha estrenado y grabado numerosas obras para arpa de compositores españoles.",[''],En Familia. Otoño 2022,,,1 hora,,No details,['CONCIERTOS'],https://www.lacasaencendida.es/conciertos/pia-pia-arpia-3,https://www.lacasaencendida.es/storage/6222/responsive-images/14017-609f-pia_pia_arpia_en_familia_2022_nt___detail_1600_900.jpg
144,Día sin Arte 2022: Siendo y Perteneciendo,No definido,2 dic 2022,"La Casa Encendida colabora con Visual AIDS con motivo del Day With(out) Art (Día sin Arte) 2022 y proyecta de forma gratuita Siendo y Perteneciendo, un programa de siete videos cortos que destacan las historias poco contadas sobre el VIH y el SIDA desde la perspectiva de artistas que viven con VIH en todo el mundo.
Duración: 1 hora","El programa presenta trabajos recientemente comisionados de Camila Arce (Argentina), Davina “Dee” Conner and Karin Hayes (Estados Unidos), Jaewon Kim (Corea del Sur), Clifford Prince King (Estados Unidos), Santiago Lemus and Camilo Acosta Huntertexas (Colombia), Mikiki (Canadá), and Jhoel Zempoalteca and La Jerry (México).
Desde el sexo y la intimidad hasta el estigma y el aislamiento. Estos videos se centran en las realidades emocionales de vivir con VIH en la actualidad. ¿Cómo cambia la forma en que una persona experimenta, pide o brinda amor, apoyo y pertenencia? Los siete videos presentados en Siendo y Perteneciendo son un llamado a pertenecer a quienes han sido estigmatizados dentro de sus comunidades o excluidos de las principales narrativas sobre el VIH/SIDA.
Visual AIDS es una organización sin fines de lucro con sede en Nueva York que utiliza el arte para luchar contra el SIDA provocando el diálogo, apoyando a los artistas VIH+ y preservando un legado, porque el SIDA no ha terminado.
Programa:
Los Amarillos, de Santiago Lemus y Camilo Acosta Huntertexas. Colombia. 2022. 10'16''. En Colombia, muchas personas que viven con el VIH experimentan Ictericia, el color amarillento de los ojos y la piel como efecto secundario de los medicamentos antirretrovirales de bajo costo suministrados por el gobierno. Los Amarillos es un video experimental que aborda la alienación y la hipervisibilidad que los artistas han enfrentado como resultado de este efecto secundario.",[''],Not in a group,,,1 hora,,No details,['CINE'],https://www.lacasaencendida.es/cine/dia-arte-2022-siendo-perteneciendo,https://www.lacasaencendida.es/storage/6280/responsive-images/14165-609f-bichudas_nt___detail_1600_900.jpg
145,Cinco años de The video essay,No definido,1 dic 2022,La llegada del vídeo-ensayo supuso un impulso sin precedentes para la crítica y el análisis fílmico; una nueva forma de estudiar el cine del pasado y el presente que cuenta ya con sus propios maestros.,"Autores como Adrián Martín, Cristina Álvarez López, Kevin B. Lee y kogonada establecieron algunos de los códigos esenciales de esta disciplina profundamente creativa y heterodoxa. 
En 2017, FILMADRID creaba junto a la plataforma de cine online MUBI, The Video Essay, la primera sección organizada por un festival de cine consagrada en exclusiva al arte del vídeo-ensayo.
Desde entonces, más de 40 trabajos han participado en este espacio. 
Esta sección no competitiva del festival reivindica una vez más la importancia de repensar las imágenes y el cine desde una perspectiva teórica que se funde con la práctica. 
FILMADRID presenta una antología de esas obras, incluyendo una obra de cada edición, componiendo así un panorama único que demuestra la importancia y constante evolución del vídeo-ensayo. 
Los trabajos seleccionados para este programa son:
The Eternal Virgin, de Jorge Suárez-Quiñones Rivas. España, 2017.
Hollis, de Miguel Rodríguez. España, 2018. 
Correct Machine, de Eva Elcano Fuentes. España, 2019.
Apunte 7, de Mayra Morán. Chile / España,  2020.  
From The Flicker to Gaspar Noé, de Carlos Baixauli, 2021.
Back to Theaters, de Victoria Oliver Farner. España,  2022. ",[''],Pasajes FILMADRID,,,2 horas,,No details,['CINE'],https://www.lacasaencendida.es/cine/cinco-anos-video-essay,https://www.lacasaencendida.es/storage/5847/responsive-images/13411-609f-pasajes_video_essay_nt___detail_1600_900.jpg
146,Encuentro con Concha García y María Ángeles Maeso,No definido,1 dic 2022,"La Biblioteca de La Casa Encendida acoge este encuentro en el que las dos poetas nos presentarán sus últimos libros, Cuota de mal (Concha García) y ""Quién es se"" (María Ángeles Maeso) pertenecientes a la colección de Poesía Rayo Azul de Huerga & Fierro Editores. El acto estará presentado por la escritora y antóloga Noni Benegas.","CUOTA DE MAL, de Concha García es un poemario maduro y reivindicativo de la poesía. Este libro recoge el pensamiento y la poética de la cordobesa, afincada en Barcelona desde hace muchos años, Concha García (La Rambla, 1956). No es ni más ni menos que las preguntas, más que las respuestas, que se hace con el paso de los años, en una vida dedicada a la literatura, como es la suya. Un vocabulario de colores y de momentos y situaciones nos da cuenta desde su mirada lírica, penetrante e irónica, de las cosas que hay fuera de nuestra mente. Posiblemente, todo lo que la persona lectura se pregunte lo encontrará entre esta sesentena de poemas certeros, cual latigazos cerebrales: para despertar. Cuota de mal es un buen regalo para el cerebro de las personas lectoras que abran sus páginas y lean. ¡No cabe ninguna duda!
La poesía de Concha García siempre nos descubre, con esa su peculiar mirada, toda la realidad que nos rodea. Es capaz y logra elevar la anécdota diaria, el momento, el suceso, a la categoría de poesía, sin tapujos ni ornamentación ni retórica posible. Versos claros y concisos. No busquen otra cosa, solo esa poesía trabajada, pulida, diamantina. “Amada orilla del mar/ cuando contemplo tu extensión/ no miro hacia atrás”.
¿QUIÉN ES SE?, de María Ángeles Maeso es una categoría gramatical que se disfraza y juega a las cuatro esquinas. A una de ellas no le gusta nada dar la cara y actúa en la sombra como los modos de producción del materialismo. Se, es el sujeto buscado que, por este poemario, brujulea.
CONCHA GARCÍA nació en 1956 (La Rambla, Córdoba). Ha vivido en Barcelona la mayor parte de su vida. Autora de varios poemarios: Ya nada es rito y otros poemas, Obra reunida1990- 2003, 2018; Acontecimiento, 2008; El día anterior al momento de quererle, 2013; Las proximidades, 2016 y Vasta Sed, 2020. Autora de ensayos sobre poesía: Asomos de Luz y Miradas en los entresijos, 2020; y de diarios: La Lejanía. Cuaderno de Montevideo, 2013; Los antiguos domicilios, 2016; Desvío a Buenos Aires. Diario de una poeta en la Patagonia argentina, 2019 y Ciudades escritas, 2019. Autora de dos antologías de poesía de la Patagonia Argentina. Ha sido premiada en varios Certámenes: Aula Negra de la Universidad de León. Premio Barcarola de Poesía, Jaime Gil de Biedma, Dama de Baza. Tiene la Licenciatura en Filología Hispánica por la Universidad de Barcelona.",[''],Encuentro con autores 2022,,,1 hora 30 minutos,,No details,['ENCUENTROS'],https://www.lacasaencendida.es/encuentros/encuentro-concha-garcia-maria-angeles-maeso,https://www.lacasaencendida.es/storage/6262/responsive-images/14122-609f-angeles_maeso_concha_garcia_2022_nt___detail_1600_976.jpg
147,Piloto de caza. Barbarie y terror aéreo en Argentina,No definido,1 dic 2022,"Argentina, 1955. En un intento de golpe de Estado Cívico-Militar, pilotos de la aviación naval y Fuerza Aérea Argentina bombardean la ciudad abierta de Buenos Aires.","Piloto de caza, de Nicolás Dalmasso. Argentina. 2020. 69´
En Piloto de caza, el piloto e investigador Alejandro Covello cuenta la historia del Teniente Ernesto Jorge «Muñeco» Adradas, quien combatió en el aire contra los golpistas y derribó un avión atacante, salvando así incontables vidas inocentes, en el que es el mayor atentado terrorista de la historia argentina, con más de 300 muertos y miles de heridos.
Tras la proyección tiene lugar un coloquio abierto.
Participan:
Nicolás Dalmasso, director de cine (online).
Alejandro Covello, piloto e investigador.
Modera: Miriam Soto Lucas, periodista.",[''],Paz y Memoria. Festival Robert Capa estuvo aquí,,,2 horas,,No details,"['CINE', 'ENCUENTROS']",https://www.lacasaencendida.es/cine/piloto-caza-barbarie-terror-aereo-argentina,https://www.lacasaencendida.es/storage/6295/responsive-images/14206-609f-piloto_caza_barbarie_terror_aereo_argentina_nt___detail_1600_900.jpg
148,La imagen de la Guerra y la guerra de la imagen,No definido,30 nov 2022,La invasión rusa de Ucrania ha reabierto un escenario bélico en Europa que parecía superado y ha vuelto a poner al periodismo gráfico en el centro de todas las miradas.,"Bajo los conceptos paz y memoria como ejes vertebradores de este festival, abordamos la mirada de tres reporteros gráficos que han construido la imagen de los conflictos armados de las últimas décadas. Javier Bauluz, Luis de Vega y Peter Everett son tres profesionales de la imagen que han cubierto multitud de conflictos en todo el mundo. La mesa pretende reflexionar sobre la importancia de la imagen en momentos de conflictos y su capacidad de influencia social en la era de las redes sociales.
Intervienen:
Javier Bauluz, fotoreportero. Premio Pulitzer.
Luis de Vega, enviado especial de El País en Ucrania (online).
Irene Savio, periodista experta en conflictos, migraciones y derechos humanos (online).
Modera y presenta: José Gómez Isla, profesor de la Facultad de Bellas Artes de la Universidad Complutense. Comisario y crítico de Arte.",[''],Paz y Memoria. Festival Robert Capa estuvo aquí,,,2 horas,,No details,['ENCUENTROS'],https://www.lacasaencendida.es/encuentros/imagen-guerra-guerra-imagen,https://www.lacasaencendida.es/storage/6294/responsive-images/14205-609f-festival_robert_capa_guerra_imagen_nt___detail_1600_900.jpg
149,"Democracia cultural: conversaciones, encuentros y saberes compartidos",No definido,30 nov 2022,¿Cómo se llevan a la práctica los derechos culturales? ¿Cómo se avanza hacia una mayor democracia cultural? ¿Qué hay que tener en cuenta en el desarrollo de un proyecto de mediación artística y cultural comunitaria?,"Compartimos ideas y reflexiones en torno a estas cuestiones con los agentes implicados en 13 proyectos que han contado con el acompañamiento de la Fundación Daniel y Nina Carasso.
Mediadoras culturales, artistas y profesionales de la administración pública comparten saberes a partir de su experiencia en el desarrollo de los siguientes proyectos:
Barrios convivenciales ante la emergencia climática y social (Sevilla).
erro(re)tik (Donostia).
Pensar una hache (Zaragoza).
La voz que nadie escucha (Madrid).
Habitar el palacio (Extremadura).
mar (Madrid).
Rehacer y expandir la mediación cultural (Madrid).
Red de espacios y agentes de cultura comunitaria (España).
Gravedad13 (Madrid).
Culturarios (España).
Es nuestro (Madrid).
Uci pediátrica (Tenerife).
Fortaleciendo la cultura comunitaria en Aragón (Aragón).",[''],Not in a group,,,2 horas,,No details,['ENCUENTROS'],https://www.lacasaencendida.es/encuentros/democracia-cultural-conversaciones-encuentros-saberes-compartidos,https://www.lacasaencendida.es/storage/6303/responsive-images/14243-609f-democracia_cultural_nt___detail_1600_902.jpg
