,title,artist,date,description,text,tags,group,Dirigido a,Ubicación,Duración,Precio,event,category,url,image
49,La mala familia,Nacho A. Villar y Luis Rojo,12 may - 13 may 2023,"Una barbacoa, música, mucho alcohol, risas, rabia contenida y, también, un sinfín de caricias invisibles entre los miembros de esa familia elegida.","La mala familia, de Nacho A. Villar y Luis Rojo (colectivo Brbr). España, 2022. 81 min.
Es verano en Madrid y Andresito acaba de salir de permiso penitenciario. El pretexto perfecto para que su grupo de amigos, disperso y herido, tras el juicio que les cambió la vida, se reencuentren. Andresito, Nata, Sebas, Jamel, Chimaira, y el resto de chicos que componen esa familia elegida, huyen de esa ciudad monstruosa y extranjera que es Madrid por el espacio de un día. Con el pantano de San Juan como escenario onírico, los amigos se atreverán por fin a hacerse las confidencias atravesadas desde la condena que les une a todos.
El primer largometraje de Nacho A. Villar y Luis Rojo (colectivo Brbr) es una de las películas más brutalmente honestas y hermosas de los últimos tiempos. La película se revela como una crónica lacerante de los graves problemas sociales que atraviesan los miembros de esta particular tribu, cabalgando constantemente entre la verdad de sus vidas, y la verdad repetida de la pantalla.
La mala familia es un golpe en las entrañas. La prueba ineludible de que entre el cine y la vida no hay ninguna diferencia.
Nacho A. Villar y Luis Rojo conforman Brbr, un colectivo fílmico que reside en Madrid y Londres, nacido en 2014 en la escena del videoclip y la música urbana. Apuestan por nuevos formatos y por una visión cinematográfica y artística pionera en ese momento.
El colectivo Brbr y Olivier Arson presentan Aproximaciones, una sesión de escucha asentada en la banda sonora de La mala familia en el Torreón 1 los días 13 y 14 de mayo.",['#Audiovisuales'],Las favoritas de Elena López Riera,Público general,Sala Audiovisual,,4€,"El colectivo Brbr y Olivier Arson presentan Aproximaciones, una sesión de escucha asentada en la banda sonora de La mala familia. En el Torreón 1 los días 13 y 14 de mayo.
Coloquio posterior el día 12 con Elena López Riera y Brbr.","['CINE', 'ENCUENTROS']",https://www.lacasaencendida.es/cine/la-mala-familia-de-nacho-a-villar-y-luis-rojo,https://www.lacasaencendida.es/storage/12583/responsive-images/la-mala-familia-de-nacho-a-villar-luis-rojo___detail_1600_897.jpg
50,Programa 2. Ser colectivo,No definido,11 may 2023,¿Cómo me relaciono con otros individuos? ¿Como actúo en lo social? En este programa se ahonda en las relaciones personales y las nuevas formas de comunicación. ,"Cut Out, de Guli Silberstein. Reino Unido, 2014. 4’
Una niña palestina rebelde y furiosa grita y golpea el espacio vacío que tiene delante. Un algoritmo de ordenador la separa de su entorno, y sus enemigos se borran del cuadro. A partir de un video de YouTube, Guli Silberstein logra crear un cortometraje sin tiempo estirando esos 4 min al infinito, desnudando el ser humano virtualmente y en la realidad.
Guli Silberstein es un artista con sede en Londres que crea trabajos de video digital desde 2001. Su obra se caracteriza por mezclar películas caseras, metraje encontrado y tecnologías digitales como el glitch, últimamente centrándose en las emocionantes posibilidades inherentes a la Inteligencia Artificial.
Mass Ornament, de Natalie Bookchin. EEUU, 2009. 7’
Un viaje al mundo “vintage” virtual de la pasada década, a través de un mosaico de bailes de YouTube que nos conecta con el actual Tik Tok; una gran coreografía coral y colectiva al ritmo de la banda sonora de dos películas de 1935: Gold Diggers de Busby Berkeley y El triunfo de la voluntad de Leni Riefenstahl.
Natalie Bookchin es una artista estadounidense de Brooklyn conocida especialmente por su trabajo en medios digitales, así como por teorizar sobre Internet como un espacio para la producción de arte. Su trabajo más reciente incluye videos e instalaciones audiovisuales que muestran y archivan flujos de datos de cámaras de seguridad, generando retratos inusuales de paisajes globales.",['#Audiovisuales'],"LIT: Ah sh*t, here we go again…",Público general,Sala Audiovisual,2 horas,4€,No details,"['CINE', 'ENCUENTROS']",https://www.lacasaencendida.es/cine/programa-2-ser-colectivo,https://www.lacasaencendida.es/storage/12559/responsive-images/cut-out-de-guli-silberstein___detail_1600_900.jpg
51,¿Es posible resolver el problema de la vivienda?,No definido,9 may 2023,"El desajuste entre los precios de las viviendas y la capacidad de renta de los hogares es la máxima expresión del problema y requiere nuevas vías de actuación que, yendo a la raíz de las causas, proporcionen una respuesta eficaz y duradera para garantizar una oferta diversa y suficiente de vivienda en alquiler asequible, a resguardo de las tensiones del mercado.","Aunque el tema ""ha explotado"" en los medios por la aprobación de la Ley Estatal de Vivienda y el anuncio de algunas actuaciones para incrementar la oferta, el de la vivienda no es en absoluto un problema coyuntural. Por el contrario, es estructural y exige una visión sosegada y a largo plazo, tal como se plantea en esta sesión. ""No deberíamos seguir buscando las soluciones en la construcción, es preciso darle un giro radical al modo de enfocar un problema que es social, poniendo a las personas en el centro, con un marco normativo estatal que, sobre todo, regule y gestione el derecho a la vivienda"".
El desajuste entre los precios de las viviendas y la capacidad de renta de los hogares es un problema crónico que impide disfrutar de una vivienda digna y adecuada y que se ha visto agravado durante los últimos años por la sucesión de crisis económicas de distinta naturaleza. No es nuevo ni más agudo el problema, pero sí requiere respuestas diferentes, porque no han sido eficaces las políticas que se han aplicado durante decenios y porque así lo requiere una sociedad diferente, con nuevas y cambiantes necesidades de vivienda, y un parque residencial envejecido con una estructura de propiedad muy atomizada.
Es preciso darle un giro radical al modo de enfocar un problema que es social. La Ley estatal de vivienda ha de conseguir que las políticas pongan el foco en las necesidades de las personas. No se debe seguir buscando la solución únicamente en la construcción de nueva vivienda y, más allá del tema de los precios, habrá que regular y gestionar más eficazmente para optimizar la utilización del parque residencial existente.",['#Sostenibilidad #Arquitectura #Urbanismo'],Not in a group,Público general,Sala Audiovisual,2 horas,,"Intervienen:
Felipe Iglesias González, experto en Derecho Inmobiliario. Profesor UAM, Consultor Uría-Menéndez.
Beatriz Toribio, analista de tendencias del sector inmobiliario. Directora General Adjunta en Masteos.             
Gema Gallardo Pérez, directora general en Asociación Provivienda.     
José María de la Riva Ámez, profesor de Geografía, Grupo TRyS -Territorio Racional y Sostenible.
Julio Vinuesa Angulo, catedrático Emérito UAM, Grupo TRyS -Territorio Racional y Sostenible.
Organizado por: Julio Vinuesa Angulo, José María de la Riva Ámez y La Casa Encendida.
Entrada libre hasta completar aforo.
 ",['ENCUENTROS'],https://www.lacasaencendida.es/encuentros/es-posible-resolver-el-problema-de-la-vivienda,https://www.lacasaencendida.es/storage/12697/responsive-images/es-posible-resolver-el-problema-de-la-vivienda___detail_1600_1056.jpg
52,I Congreso Internacional de familias víctimas de las fronteras,No definido,9 may 2023,"Desde hace años, el colectivo Caminando Fronteras denuncia un vacío en la atención a familiares que buscan a las personas migrantes desaparecidas durante el trayecto migratorio. En relación con este trabajo, se organiza este primer Congreso que aborda la situación de las personas desaparecidas migrantes de una manera multidisciplinar, con perspectiva de género y antirracista. ","Este encuentro incluye como ponentes a las familias de las personas desaparecidas, miembros de Comités de Naciones Unidas, forenses, juristas y personas expertas en materia de derechos humanos, derechos de personas migrantes.
Programa:
Inauguración del congreso por parte de la Secretaria de Estado para la Agenda 2030. Dña. Lilith Verstrynge. 
Los desafíos del derecho internacional frente a las violaciones de derechos humanos en las fronteras.
Modera: Helena Maleno (fundadora del Colectivo Caminando Fronteras).
Participantes: Felipe González (Relator de las Naciones Unidas para las Personas Migrantes) y Pablo Ceriani (miembro del Comité de Protección de los Derechos de los Trabajadores Migrantes de Naciones Unidas).
Transformar el dolor en justicia: la movilización de las familias víctimas de las fronteras.
Modera: Nicolás Castellano (periodista de la Cadena SER).
Participan: familiares de personas desaparecidas en las fronteras.",['#Contextos internacionales'],Not in a group,Público general,Auditorio,7 horas 30 minutos,,"Organizado por: Caminando Fronteras 
Inscripción al Congreso:  https://caminandofronteras.org/inscripcion-en-el-i-congreso-internacional-de-familias-victimas-de-las-fronteras/",['ENCUENTROS'],https://www.lacasaencendida.es/encuentros/i-congreso-internacional-de-familias-victimas-de-las-fronteras,https://www.lacasaencendida.es/storage/12756/responsive-images/i-congreso-internacional-de-familias-victimas-de-las-fronteras___detail_1600_900.jpg
53,Presentación Espacio Creadoras,No definido,7 may 2023,"Durante todo el fin de semana cinco personas estarán diseñando, creando y desarrollando los diferentes proyectos que tendrán el upcycling como hilo conductor.","Como venimos haciendo desde 2016, vuelve el Maratón de Reciclaje Textil Creativo para unirse al movimiento Fashion Revolution y defender la moda como elemento de transformación social. Las creadoras trabajarán en sus propuestas durante el fin de semana, en el Patio de La Casa Encendida, en un espacio que fomenta la interacción con el público durante el proceso.
Los cinco proyectos seleccionados esta vez para el Espacio Creadoras estarán realizados por cinco personas que ya han participado en ediciones anteriores. En esta edición, las propuestas serán más amplias, no limitándose necesariamente a la creación de una prenda.
Este año nos acompañan:
Laura Casanova
Laura Casanova participó en la primera y segunda edición como creadora y en la cuarta edición ofreció un taller de reutilización con camisas. Siempre ha destacado por su trabajo minucioso basado en líneas limpias.
Lara Padilla
Tuvimos la suerte de compartir el Maratón Online de 2020 con Lara Padilla o Sra. D., una artista multidisciplinar que vive y trabaja entre Madrid, Miami y Nueva York. En su propuesta incluye la pintura a mano como elemento de expresión que da una textura única a cada una de sus piezas.",['#Diseño #Reciclaje #Sostenibilidad'],VII Maratón de reciclaje textil creativo,Público general,Patio,1 hora,,Acceso libre.,"['ENCUENTROS', 'PROYECTO']",https://www.lacasaencendida.es/encuentros/presentacion-espacio-creadoras,https://www.lacasaencendida.es/storage/12746/responsive-images/presentacion-espacio-creadoras___detail_1600_1067.jpg
54,Estación de reparación textil,No definido,7 may 2023,Un espacio donde se podrán realizar pequeños arreglos y reparaciones a nuestras prendas y defender el derecho a la reparación.,"A través de este espacio, conectado con el movimiento Right to Repair, impulsamos la circularidad y el consumo sostenible de ropa, en el que el cuidado de nuestras prendas es un hábito fundamental. Desde el movimiento Europeo Right to Repair se defiende que los productos deben ser más duraderos y esto requiere que estén diseñados pensando en su reparación y también que se facilite el acceso a todo tipo de reparaciones.
La estación de reparación está diseñada para facilitar herramientas, recursos y conocimientos básicos para poder arreglar nuestras prendas.
No es un taller o una clase de costura donde una sola persona enseña y las demás aprenden si no que está enfocada para aprender de manera colaborativa. Contaremos con personas que facilitarán el espacio y las reparaciones. Pero tanto si las personas saben coser como si no, pueden acercarse para realizar arreglos o ayudar a otras personas a hacerlos.
Los tipos de reparaciones en prendas que podrán realizarse son más o menos sencillos y para todos los niveles: botones, bajos, parcheados, zurcidos, cremalleras y bolsillos. Para facilitar estos arreglos dispondremos de todos materiales, recursos y herramientas necesarias.
El funcionamiento de la estación de reparación es dinámica. La participación tiene lugar por franjas de máximo 90 minutos en caso de que haya otras personas esperando.",['#Diseño #Reciclaje #Sostenibilidad'],VII Maratón de reciclaje textil creativo,Público general,Patio,6 horas,,"Es espacio está dinamizado por Costura Remake. 
Asistencia libre hasta completar aforo.",['ENCUENTROS'],https://www.lacasaencendida.es/encuentros/estacion-de-reparacion-textil,https://www.lacasaencendida.es/storage/12747/responsive-images/estacion-de-reparacion-textil___detail_1600_1067.jpg
55,Taller de joyas sostenibles a partir de residuo textil,No definido,6 may 2023,"Proponemos este taller de joyas sostenibles, elaboradas a partir de desechos textiles de MENOStrash, donde podrás aprender y crear tus propias joyas.","En este taller con MENOStrash queremos brindarte una experiencia completa en términos de aprendizaje y creación. A continuación, te presentamos lo que podrás disfrutar:
Comenzaremos con una charla de 30 minutos en la que te contaremos la historia que hay detrás del proyecto, cómo se creó el material y su impacto positivo en el medio ambiente. Te mostraremos el proceso de triturado de los textiles y te explicaremos la composición de los mismos. Elegiremos los moldes justos para que puedas crear tus propios pendientes o colgantes con el material de MENOStrash. Te entregaremos el material listo para que puedas dar rienda suelta a tu creatividad y moldearlo a tu gusto. Además, si tienes alguna cadena o collar que te gustaría incorporar en tu diseño, tráelo contigo y te ayudaremos a combinarlo con el material de MENOStrash. Una vez que hayas terminado tu creación, te daremos las indicaciones necesarias para que puedas secarlo y lucirlo con orgullo.
Se ruega puntualidad. Una vez comenzado el taller, si la persona inscrita no ha llegado se pondrá la plaza a disposición del público interesado. Agradeceremos no obstante, que se comuniquen las posibles ausencias con antelación.",['#Diseño #Reciclaje #Sostenibilidad'],VII Maratón de reciclaje textil creativo,Público general,Terraza,2 horas,,El taller está completo. ,"['ENCUENTROS', 'PROYECTO']",https://www.lacasaencendida.es/encuentros/taller-de-joyas-sostenibles-a-partir-de-residuo-textil,https://www.lacasaencendida.es/storage/12748/responsive-images/taller-de-joyas-sostenibles-a-partir-de-residuo-textil___detail_1207_1200.jpg
56,Vainilla,Guillaume Lorin y otras historias,6 may - 7 may 2023,Cinco cortometrajes sobre la aceptación de los propios orígenes y valorar la diversidad.,"Vainilla, de Guillaume Lorin. Francia, 2020. 30’
Vainilla, una niña parisina, llega a la Isla de Guadalupe para pasar las vacaciones con su tía. Al principio rechaza todo lo relacionado con la isla, pero poco a poco irá descubriendo sus misterios y se adentrará en una aventura exótica llena de personajes pintorescos y elementos mágicos.
Mi amigo Tigre, Tatiana Kiseleva. Rusia, 2021. 8’
Una niña y su amigo Tigre pasean en bicicleta por la ciudad. Están todo el día haciendo cosas juntos y compartiendo experiencias hasta que un día la ciudad se quedará demasiado pequeña para Tigre.
Cada día hablas mejor, de Julie Daravan Chea. Francia, 2020. 4’
Aline y su madre Chanda, provenientes de Camboya, viven juntas en un suburbio en Francia. Aline descubre que se está planificando una reunión de padres, pero no quiere que su madre vaya porque le da vergüenza que no hable bien francés.
Idodo, Ursula Ulmi. Suiza, 2021. 10’
Idodo explica la leyenda de cómo los peces de arrecife obtuvieron sus magníficos y deslumbrantes colores.
Curry azul, Magali Dunyach, Chien-Ju Hung. Francia, 2021. 6’",['#Audiovisuales'],En Familia. Primavera 2023,Infantil,Sala Audiovisual,,4€,"Las actividades de En Familia son para el público infantil, así que deben comprar entrada todos los asistentes sin importar la edad. No está permitida la entrada a mayores si no van acompañados de un menor.
Edad recomendada: a partir de 5 años.","['CINE', 'EN FAMILIA']",https://www.lacasaencendida.es/cine/vainilla-de-guillaume-lorin-y-otras-historias,https://www.lacasaencendida.es/storage/12587/responsive-images/vainilla-de-guillaume-lorin___detail_1600_866.jpg
57,"'Upcycle Yourself', performance participativa de Maroussia Rebecq",No definido,6 may 2023,"La performance estará dirigida por Maroussia Rebecq, siguiendo la metodología que utiliza en su colectivo Andrea Crews.","Junto con un equipo de estilistas, costura, maquillaje, peluquería, fotografía y video, transformaremos el Patio en un estudio de diseño donde el público asistente podrá vivir la experiencia de ser modelo de una transformación total a partir del reciclaje.
En pocos minutos, las personas que se acerquen al evento podrán pasar por las manos de este equipo de trabajo, bajo la dirección de Maroussia Rebecq, para vivir un cambio de look total a través del upcycling o reciclaje.
Toda la ropa que se usará en el evento proviene de Recumadrid, entidad de inserción socio laboral con la que colaboramos desde las primeras ediciones del Maratón.
 ",['#Diseño #Reciclaje #Sostenibilidad'],VII Maratón de reciclaje textil creativo,Público general,Patio,8 horas,,Asistencia libre.,"['ESCÉNICAS', 'PROYECTO']",https://www.lacasaencendida.es/escenicas/upcycle-yourself-performance-participativa-de-maroussia-rebecq,https://www.lacasaencendida.es/storage/12749/responsive-images/%27upcycle-yourself%27-performance-participativa-de-maroussia-rebecq___detail_1600_1067.jpg
58,Sòc vertical però m’agradaria ser horitzontal + Los conductos,No definido,5 may - 6 may 2023,"Doble sesión compuesta por el mediometraje de María Antón Cabot, en el que Sylvia Plath y Belén Esteban pasean juntas por Benidorm, y el primer largometraje de Camilo Restrepo, una alucinada crónica de su país, entre cine negro, punk, y psicodelia.","Sòc vertical però m’agradaria ser horitzontal, de María Antón Cabot. España, 2022. 39 min
Poca gente lo sabe, pero Sylvia Plath pasó muchas horas y escribió algunos poemas en el Benidorm de los años 50. Belén Esteban (esto quizá es más conocido) ha hecho de la ciudad más fascinante del levante español, su paraíso perdido. Sòc Vertical però m’agradaria ser horitzontal es un verso de Plath que no sólo da título a la película, sino que también funciona como el enigma que une a estas dos mujeres a través de los años. María Antón Cabot permite, en un ejercicio de libertad y poesía sin límites, que estas dos mujeres, separadas por el tiempo, se reúnan para compartir sus soledades, en el espacio de una misma e imposible noche.
Ser vertical, pero querer tumbarse, ser vertical y querer perderse, ser vertical e invisible, ser vertical e inmune a los dolores del mundo. Ésta podría ser la íntima letanía que repiten Sylvia y Belén en la común deriva que emprenden para alejarse de un mundo, que se niega a ver lo que realmente hay en ellas. Ser vertical y encontrar en la otra un espejo en el que desaparecer.
María Antón-Cabot es directora, editora y guionista nacida en Benidorm en 1982, se licenció en Comunicación Audiovisual y tiene un posgrado en creación en la Elias Querejeta Zine Eskola. En 2009 funda el colectivo lacasinegra junto a Elena López Riera, Gabriel Azorín y Carlos Pardo Ros con el que desarrolla diferentes proyectos que relacionan el cine con las formas contemporáneas de producción y difusión del audiovisual.",['#Audiovisuales'],Las favoritas de Elena López Riera,Público general,Sala Audiovisual,,4€,Coloquio posterior el día 6 de mayo con Elena López Riera y María Antón Cabot.,"['CINE', 'ENCUENTROS']",https://www.lacasaencendida.es/cine/soc-vertical-pero-magradaria-ser-horitzontal-los-conductos,https://www.lacasaencendida.es/storage/13259/responsive-images/SocVertical_STILL_1___detail_1600_1029.jpg
59,"Less-than-human: Amanda Piña, Paz Rojo, Victoria Pérez Royo",No definido,5 may 2023,"Parte de los encuentros More-than-human, en esta sesión las artistas e investigadoras abordarán las prácticas en la performance sobre descentralización de la condición humana.","Los humanos convivimos en este planeta con una gran variedad de seres vivos e inertes o sin vida. El título de este encuentro pretende cuestionar la posible condición menor de la humanidad en este montaje. Si bien la serie propone considerar formas de vida y conocimiento fuera del estado humano clásico, nos preguntamos cómo sumar restando. Es decir, a través de ciertas renuncias en lugar de adquirir habilidades nuevas o adicionales. De ahí que propongamos less-than-human (lo inferior a lo humano).
Las tres invitadas al encuentro tienen una larga trayectoria en este sentido y mantienen inquietudes sobre este tema en sus proyectos actuales, que se pueden resumir en la propuesta general de descentralizar la condición humana clásica occidental hasta sus límites posibles. Amanda Piña trabaja en torno a la descolonización de la coreografía, introduciendo lo que ella llama Movimientos Humanos Amenazados en muchos niveles: el conocimiento oral, el chamanismo, los rituales diplomáticos o la sabiduría vegetal, entre otros. Paz Rojo trabaja sobre los restos de cuerpos extenuados tras lo que denomina el declive de la coreografía neoliberal, proponiendo operaciones concretas de resubjetivación a través del movimiento corporal. Victoria Pérez Royo investiga actualmente otras afectividades, centrando su mirada en lo que ella llama el cuerpo anacrónico, aquel movido por ritos como la magia, por ejemplo, o por cualquier modalidad ritual que contrarreste la corporalidad hegemónica moderno-colonial. Las tres invitadas dialogarán entre sí a través de un dispositivo de juego discursivo generado a partir de sus propias prácticas, entrelazadas y puestas en relación mutua.
Victoria Pérez Royo es investigadora en artes escénicas, profesora de la Facultad de Filosofía (Unizar) y ha impartido clases a nivel internacional. Miembro de la asociación de investigación ARTEA, ha ideado y coordinado contextos de investigación basados en la práctica en centros de arte como el Museo Reina Sofía, La Casa Encendida y Matadero (Madrid). Últimas publicaciones: Cuerpos fuera de sí (Documenta/Escénicas 2022) y editora de ""Time se ha dormido en el sol de la tarde"", un libro sobre lectura, escritura, memoria y olvido (con Mette Edvardsen, Mousse Press 2019), así como de ""Afectividades otras, magias, cuerpos"" (con Rut Martín, Accesos, 2021).",['#Pensamiento'],Not in a group,Público general,,1 hora 30 minutos,4€,El evento puede seguirse en vivo en el Auditorio y a través del canal de youtube de La Casa Encendida.,"['ENCUENTROS', 'ESCÉNICAS']",https://www.lacasaencendida.es/encuentros/less-than-human-amanda-pina-paz-rojo-victoria-perez-royo,https://www.lacasaencendida.es/storage/12764/responsive-images/less-than-human___detail_1600_1200.jpg
60,Nuevas ecotopías para estos tiempos,Kim Stanley Robinson,26 mar 2023,"Se han referido a Kim Stanley Robinson como el Julio Verne del siglo XXI, al ser el escritor de ciencia ficción que de una forma más detallada y provocadora está describiendo escenarios de futuro en los que la humanidad ha logrado afrontar con éxito las transiciones ecosociales.","Además es una de las figuras públicas que más tiempo lleva denunciando el perverso efecto de las distopías y defendiendo la necesidad de recuperar un impulso utópico para avanzar en los inaplazables cambios sociales que tenemos por delante. Este encuentro es una oportunidad inigualable para escucharle y reflexionar conjuntamente sobre la importancia de imaginar otros mundos desde el utopismo ecológico.
En él se harán las siguientes preguntas: ¿Las distopías se han vuelto conservadoras y predecibles? ¿La distopía nos reconcilia con el presente o sensibiliza y activa a la ciudadanía para cambiarlo? ¿Necesitamos recuperar un impulso utópico y activar una imaginación política? ¿Por qué son útiles narrativas que nos permitan visualizar cómo serían sociedades donde las transiciones ecosociales hubieran sido exitosas?
Kim Stanley Robinson. Escritor norteamericano de ciencia ficción que ha ganado los principales premios mundiales del género. Entre sus numerosas publicaciones conectarían especialmente con este ciclo Trilogía de Marte, Nueva York 2140, 2312 o Ministerio del futuro.
Coordina: José Luis Fernández Casadevante Kois, Cooperativa Garúa
Organiza: La Casa Encendida y Cooperativa Garúa.",[''],Ecotopías,,,1 hora,,,"['ONLINE', 'ENCUENTROS']",https://www.lacasaencendida.es/contenido-online-actividades/nuevas-ecotopias-tiempos-kim-stanley-robinson,https://www.lacasaencendida.es/storage/10789/responsive-images/14443-609f-kim_stanley_robinson_nt___detail_1600_900.jpg
